{
  "$schema": "./harvest-inventory.schema.json",
  "inventoryVersion": "1.0.0",
  "owningIssue": "HAC-321",
  "ledger": "docs/quality/harvest-ledger.md",
  "notes": [
    "Machine-checked by scripts/check-harvest.mjs, which runs inside the required Provenance boundary context.",
    "coverageRoots enumerate every place a capability can live. Every path under a root must be claimed by exactly one row, so adding a capability without a ledger row turns the gate red instead of passing silently.",
    "Findings are recorded separately from capabilities: a finding has no path, so it cannot participate in coverage."
  ],
  "dispositions": [
    "HARVEST_INTEGRATIONS",
    "HARVEST_STANDARD_RESEARCH",
    "HARVEST_STUDIO",
    "HARVEST_SWARM",
    "KEEP_INTERLOCK",
    "DELETE_HACKATHON_ONLY"
  ],
  "coverageRoots": [
    {
      "path": "src",
      "mode": "recursive"
    },
    {
      "path": "experiments",
      "mode": "children"
    },
    {
      "path": "media",
      "mode": "children"
    },
    {
      "path": "scripts",
      "mode": "children"
    },
    {
      "path": "docs/quality",
      "mode": "children"
    }
  ],
  "capabilities": [
    {
      "id": "composition-decision-core",
      "title": "Composition decision core",
      "paths": [
        "src/broker/pairing/arbitrate.ts",
        "src/broker/pairing/store.ts"
      ],
      "disposition": "KEEP_INTERLOCK",
      "rationale": "Decides whether two intents may compose. That is a prescriptive judgment, and GOVERNANCE.md rejects prescriptive policy from the standard. Harvesting it upstream would be the charter violation META-284 is unwinding."
    },
    {
      "id": "authorization-receipt-contract",
      "title": "Authorization receipt and lifecycle contract",
      "paths": [
        "src/authorization/receipt.ts",
        "src/authorization/intent.ts",
        "src/authorization/canonical.ts",
        "src/receipt.ts"
      ],
      "disposition": "HARVEST_INTEGRATIONS",
      "ownerIssue": "META-330",
      "ownerAmendedAt": "2026-08-25",
      "rationale": "The lifecycle another agent system can adopt without adopting Interlock's policy. The contract travels; the decision does not. EXECUTED and OBSERVED must not collapse in any harvested form."
    },
    {
      "id": "enforcement-proxy",
      "title": "Interlock enforcement proxy",
      "paths": [
        "src/proxy/main.ts",
        "src/proxy/service.ts",
        "src/proxy/http.ts",
        "src/proxy/identity.ts",
        "src/proxy/target-port.ts"
      ],
      "disposition": "KEEP_INTERLOCK",
      "rationale": "Reference-application enforcement path proven by HAC-326. Product, not seam."
    },
    {
      "id": "protected-target",
      "title": "Protected target service",
      "paths": [
        "src/target/main.ts",
        "src/target/service.ts",
        "src/target/http.ts",
        "src/target/state.ts"
      ],
      "disposition": "KEEP_INTERLOCK",
      "rationale": "The mutation surface the proxy protects. Exists to make the counterfactual demonstrable; not reusable outside it."
    },
    {
      "id": "broker-safety-primitives",
      "title": "Bypass guard, idempotency ledger, revision binding",
      "paths": [
        "src/broker/bypass/guard.ts",
        "src/broker/idempotency/ledger.ts",
        "src/broker/revision/revision.ts"
      ],
      "disposition": "KEEP_INTERLOCK",
      "rationale": "Fail-closed primitives bound to this broker's semantics. HAC-317 owns any production generalization; nothing is proposed for a workspacejson repository."
    },
    {
      "id": "observation-events",
      "title": "Independent observation and correlation",
      "paths": [
        "src/observation/events.ts",
        "src/correlation.ts"
      ],
      "disposition": "KEEP_INTERLOCK",
      "rationale": "Emits the state chain the cockpit renders. Travels conceptually with the receipt contract but is not separately harvestable."
    },
    {
      "id": "runtime-config",
      "title": "Runtime configuration and JSON transport",
      "paths": [
        "src/config.ts",
        "src/http/json.ts"
      ],
      "disposition": "KEEP_INTERLOCK",
      "rationale": "Ordinary application plumbing. Recorded so coverage is complete, not because it is notable."
    },
    {
      "id": "four-arm-evaluation-harness",
      "title": "Four-arm evaluation harness",
      "paths": [
        "experiments/hac-343"
      ],
      "disposition": "HARVEST_STANDARD_RESEARCH",
      "ownerIssue": "META-384",
      "ownerAmendedAt": "2026-08-25",
      "rationale": "Arms, corpus, executor and aggregation for a multi-condition comparison where every arm can fail. Carries the freeze-before-results protocol and the packet verifier in the same tree."
    },
    {
      "id": "evidence-provenance-envelope",
      "title": "Evidence provenance envelope and pinned-upstream adapter",
      "paths": [
        "experiments/hac-330"
      ],
      "disposition": "HARVEST_STANDARD_RESEARCH",
      "ownerIssue": "META-384",
      "ownerAmendedAt": "2026-08-25",
      "rationale": "Wraps a verbatim upstream result with producer SHA, package version, bundle digest, source revision, history basis and artifact digest, and refuses to run against a dirty or off-pin checkout. The synthetic-history fixtures in the same tree are superseded by META-383's use of real history and are not part of the harvest.",
      "supersededParts": [
        "experiments/hac-330/bin/build-fixtures.mjs generates synthetic Git histories; META-383 replaced the approach with real repository history. Deleted post-window with the rest of the tree's fixture machinery."
      ]
    },
    {
      "id": "public-evidence-redaction",
      "title": "Public evidence redaction and logged-out verification",
      "paths": [
        "experiments/hac-342"
      ],
      "disposition": "KEEP_INTERLOCK",
      "rationale": "Redacts a packet for publication and verifies it resolves logged out. Bound to this submission's disclosure boundary; generalizing it would mean generalizing that boundary."
    },
    {
      "id": "fallback-enforcement-path",
      "title": "S2 fallback enforcement path",
      "paths": [
        "experiments/hac-326"
      ],
      "disposition": "KEEP_INTERLOCK",
      "rationale": "The proven bounded MCP/API proxy enforcement path. Its production successor is HAC-317's scope inside this repository; nothing here is proposed for any workspacejson repository."
    },
    {
      "id": "filmed-run-capture",
      "title": "Filmed-run capture and verification",
      "paths": [
        "experiments/hac-324"
      ],
      "disposition": "HARVEST_STUDIO",
      "ownerIssue": "HAC-324",
      "ownerAmendedAt": "2026-08-25",
      "rationale": "Builds and verifies a filmed run against its scene manifest. Studio v3 is already the consumer, so this is a harvest with a live customer."
    },
    {
      "id": "gateway-provisioning-scripts",
      "title": "Agent Gateway provisioning scripts",
      "paths": [
        "experiments/hac-325"
      ],
      "disposition": "DELETE_HACKATHON_ONLY",
      "rationale": "Belongs to a path recorded as FAILED/PIVOTED. Keeping executable provisioning for an abandoned architecture invites someone to run it. HAC-338 owns the forensic finding; the scripts are not needed to preserve it."
    },
    {
      "id": "cockpit-build",
      "title": "Judge verification cockpit",
      "paths": [
        "media/hac-341"
      ],
      "disposition": "KEEP_INTERLOCK",
      "rationale": "The judge-facing surface for pinned runs, including the cold-read kit. Product."
    },
    {
      "id": "architecture-visual-suite",
      "title": "Evidence-bound architecture visual suite",
      "paths": [
        "media/hac-334"
      ],
      "disposition": "HARVEST_STUDIO",
      "ownerIssue": "HAC-324",
      "ownerAmendedAt": "2026-08-27",
      "rationale": "Generates architecture and proof visuals from machine-readable state. test/hac-334-gate-perturbation.test.mjs travels with it: a pipeline that cannot demonstrate its own gate failing is the vacuous-green case META-337 eliminated. bin/lib/motion.mjs extends the same library with a time axis — semantic and presentation tracks, deterministic state-at-time, and a reduced-motion equivalent — earned by HAC-350 needing a frame at t that does not depend on having played the cut. It is Interlock-agnostic and harvests with the rest of the suite."
    },
    {
      "id": "judge-package-and-asset-registry",
      "title": "Judge package and asset registry",
      "paths": [
        "media/hac-335"
      ],
      "disposition": "HARVEST_STUDIO",
      "ownerIssue": "HAC-324",
      "ownerAmendedAt": "2026-08-25",
      "rationale": "Binds every exported asset to an asset ID, judge question, source run, supported claim, runtime source SHA and evidence-publication SHA. The general capability is evidence-bound media."
    },
    {
      "id": "final-cut-assembly",
      "title": "Evidence-bound final cut assembly",
      "paths": [
        "media/hac-336"
      ],
      "disposition": "HARVEST_STUDIO",
      "ownerIssue": "HAC-324",
      "ownerAmendedAt": "2026-08-25",
      "rationale": "Composes a cut from an authored edit decision list and frozen artifacts, and gates the result against them: an input manifest with content digests, a scene map from timestamp to source artifact to claim, and a render manifest read back out of the encoded file. The general capability is an edit that cannot outrun its evidence, which is the same Studio customer as hac-334 and hac-335. The frames and the cut itself are this submission's, and are carried as the pipeline's output rather than as a second capability."
    },
    {
      "id": "forensic-replay-composition",
      "title": "Forensic Replay motion composition",
      "paths": [
        "media/hac-350"
      ],
      "disposition": "KEEP_INTERLOCK",